{
  "schemaVersion": 1,
  "id": "instructgpt",
  "paperId": "arxiv:2203.02155",
  "revision": 1,
  "title": "InstructGPT：从会续写文本，到更好地完成用户的要求",
  "paperTitle": "Training language models to follow instructions with human feedback",
  "language": "zh-Hans",
  "type": "method",
  "mode": "standard",
  "purpose": "理解使用目标怎样转化为人工材料、优化方法和可观察的模型行为。",
  "source": {
    "id": "arxiv:2203.02155",
    "version": "v1",
    "url": "https://arxiv.org/pdf/2203.02155v1"
  },
  "bodyFile": "instructgpt.md",
  "bodySha256": "bc9d7a42cbc55a290f5cc6086b5edd25d07a05f4cd49229100a72b863f01a38a",
  "units": [
    {
      "id": "orientation",
      "heading": null
    },
    {
      "id": "u01",
      "heading": "预训练已经带来了能力，使用目标仍需进一步表达"
    },
    {
      "id": "u02",
      "heading": "人的期望先进入材料，再进入模型"
    },
    {
      "id": "u03",
      "heading": "三个阶段各自解决一个问题"
    },
    {
      "id": "u04",
      "heading": "实验显示，改变训练方式确实改变了回答行为"
    },
    {
      "id": "u05",
      "heading": "这篇给知识体系增加了什么"
    },
    {
      "id": "u06",
      "heading": "哪些原文值得亲自读"
    }
  ],
  "citations": [
    {
      "id": "c-14e534a5b0",
      "url": "https://arxiv.org/pdf/2203.02155v1",
      "labels": [
        "原论文 v1"
      ],
      "role": "primary",
      "sourceVersion": "v1"
    },
    {
      "id": "c-2cab3ea10b",
      "url": "https://arxiv.org/abs/2005.14165",
      "labels": [
        "GPT-3 原论文摘要及 §1"
      ],
      "role": "background",
      "sourceVersion": null
    },
    {
      "id": "c-8a8adbe043",
      "url": "https://openai.com/index/instruction-following/",
      "labels": [
        "作者的方法介绍",
        "作者的 Results 与 Limitations"
      ],
      "role": "background",
      "sourceVersion": null
    },
    {
      "id": "c-f4ebd05244",
      "url": "https://arxiv.org/pdf/2203.02155v1#page=6",
      "labels": [
        "原文 §3.2–3.4，PDF 第6–8页",
        "§3.1，PDF 第6页"
      ],
      "role": "primary",
      "sourceVersion": "v1"
    },
    {
      "id": "c-19d409d379",
      "url": "https://arxiv.org/pdf/2203.02155v1#page=36",
      "labels": [
        "原文 §3.4、附录 B.2"
      ],
      "role": "primary",
      "sourceVersion": "v1"
    },
    {
      "id": "c-9c9b78d3ef",
      "url": "https://arxiv.org/abs/2009.01325",
      "labels": [
        "Learning to summarize from human feedback"
      ],
      "role": "background",
      "sourceVersion": null
    },
    {
      "id": "c-40de426bfa",
      "url": "https://arxiv.org/abs/1707.06347",
      "labels": [
        "PPO 原论文"
      ],
      "role": "background",
      "sourceVersion": null
    },
    {
      "id": "c-653dd2a12d",
      "url": "https://arxiv.org/pdf/2203.02155v1#page=3",
      "labels": [
        "原文图2，PDF 第3页",
        "图2，PDF 第3页"
      ],
      "role": "primary",
      "sourceVersion": "v1"
    },
    {
      "id": "c-6d1ed7775b",
      "url": "https://arxiv.org/pdf/2203.02155v1#page=8",
      "labels": [
        "原文 §3.5",
        "§3.5 的式（1）（2），PDF 第8页"
      ],
      "role": "primary",
      "sourceVersion": "v1"
    },
    {
      "id": "c-3ce01ac855",
      "url": "https://arxiv.org/pdf/2203.02155v1#page=10",
      "labels": [
        "原文 §3.6–4.1，PDF 第10–11页"
      ],
      "role": "primary",
      "sourceVersion": "v1"
    },
    {
      "id": "c-aa7df09eb2",
      "url": "https://arxiv.org/pdf/2203.02155v1#page=2",
      "labels": [
        "图1",
        "图1及图注，PDF 第2页"
      ],
      "role": "primary",
      "sourceVersion": "v1"
    },
    {
      "id": "c-586f78c593",
      "url": "https://arxiv.org/pdf/2203.02155v1#page=12",
      "labels": [
        "图4及说明，PDF 第12页"
      ],
      "role": "primary",
      "sourceVersion": "v1"
    },
    {
      "id": "c-37eb32d060",
      "url": "https://arxiv.org/pdf/2203.02155v1#page=11",
      "labels": [
        "§4.1，PDF 第11页"
      ],
      "role": "primary",
      "sourceVersion": "v1"
    }
  ],
  "related": [
    {
      "guideId": "helm",
      "relation": "editorial-reading-order"
    }
  ],
  "assets": [],
  "coverage": {
    "scope": "mainline",
    "basis": "sections",
    "sections": [
      "§1",
      "§3–5",
      "Selected annotation appendix"
    ],
    "figuresViewed": [
      "Figure 1",
      "Figure 2",
      "Figure 4"
    ],
    "limitations": [
      "Research-mainline guide; not all appendix experiments or PPO derivations are explained.",
      "No experiments were reproduced.",
      "Supplementary references explain background rather than verify all their experiments."
    ],
    "reviewBasis": "Inherited content/source review; no new source or figure audit during packaging."
  }
}
