{
  "schemaVersion": 1,
  "id": "helm",
  "paperId": "arxiv:2211.09110",
  "revision": 1,
  "title": "HELM：把“模型表现”变成一组能够解释的测量",
  "paperTitle": "Holistic Evaluation of Language Models",
  "language": "zh-Hans",
  "type": "evaluation",
  "mode": "standard",
  "purpose": "理解场景、适配和指标如何共同决定一次评价能说明什么。",
  "source": {
    "id": "arxiv:2211.09110",
    "version": "v2",
    "url": "https://arxiv.org/pdf/2211.09110v2"
  },
  "bodyFile": "helm.md",
  "bodySha256": "a612be64f646f9236282aaa59666bd5d7878e340b8d365efd133de97ec712d5c",
  "units": [
    {
      "id": "orientation",
      "heading": null
    },
    {
      "id": "u01",
      "heading": "作者先处理了“各自都测过，却难以比较”的问题"
    },
    {
      "id": "u02",
      "heading": "从一道真实的选择题看懂评价过程"
    },
    {
      "id": "u03",
      "heading": "七类指标是在表达七种不同要求"
    },
    {
      "id": "u04",
      "heading": "实际发现揭示了指标和设置之间的关系"
    },
    {
      "id": "u05",
      "heading": "评价研究的贡献，是让原先含糊的比较变得可解释"
    },
    {
      "id": "u06",
      "heading": "留下一条能够再次使用的认识"
    },
    {
      "id": "u07",
      "heading": "哪些原文值得亲自读"
    }
  ],
  "citations": [
    {
      "id": "c-275bffbb9f",
      "url": "https://arxiv.org/pdf/2211.09110v2",
      "labels": [
        "原论文 v2"
      ],
      "role": "primary",
      "sourceVersion": "v2"
    },
    {
      "id": "c-24afd45cd0",
      "url": "https://crfm.stanford.edu/2022/11/17/helm.html",
      "labels": [
        "作者对研究背景和原则的说明",
        "作者对核心与针对性评价的说明"
      ],
      "role": "background",
      "sourceVersion": null
    },
    {
      "id": "c-6ab4797c22",
      "url": "https://arxiv.org/pdf/2211.09110v2#page=14",
      "labels": [
        "图6，PDF 第14页",
        "图5–7及 §2.1–2.2，PDF 第14–15页"
      ],
      "role": "primary",
      "sourceVersion": "v2"
    },
    {
      "id": "c-5720052fd7",
      "url": "https://arxiv.org/pdf/2211.09110v2#page=15",
      "labels": [
        "图7，第15页"
      ],
      "role": "primary",
      "sourceVersion": "v2"
    },
    {
      "id": "c-aecfd41b18",
      "url": "https://arxiv.org/pdf/2211.09110v2#page=25",
      "labels": [
        "原文 §4"
      ],
      "role": "primary",
      "sourceVersion": "v2"
    },
    {
      "id": "c-e9c8addf06",
      "url": "https://arxiv.org/abs/1706.04599",
      "labels": [
        "校准研究的定义与背景"
      ],
      "role": "background",
      "sourceVersion": null
    },
    {
      "id": "c-f0ae265131",
      "url": "https://arxiv.org/pdf/2211.09110v2#page=6",
      "labels": [
        "原文 §1.2、§8.1"
      ],
      "role": "primary",
      "sourceVersion": "v2"
    },
    {
      "id": "c-cfac7b2d9a",
      "url": "https://arxiv.org/pdf/2211.09110v2#page=9",
      "labels": [
        "原文主要发现第23项，PDF 第9页"
      ],
      "role": "primary",
      "sourceVersion": "v2"
    },
    {
      "id": "c-99dac6832d",
      "url": "https://arxiv.org/pdf/2211.09110v2#page=7",
      "labels": [
        "原文 §1.2 的效率与模型规模讨论"
      ],
      "role": "primary",
      "sourceVersion": "v2"
    },
    {
      "id": "c-b93d61cec2",
      "url": "https://arxiv.org/pdf/2211.09110v2#page=48",
      "labels": [
        "图24，PDF 第48页",
        "图24及正文解释，PDF 第48页"
      ],
      "role": "primary",
      "sourceVersion": "v2"
    },
    {
      "id": "c-e1bf2395e0",
      "url": "https://arxiv.org/pdf/2211.09110v2#page=3",
      "labels": [
        "原文 §1.1"
      ],
      "role": "primary",
      "sourceVersion": "v2"
    },
    {
      "id": "c-7f97011fea",
      "url": "https://arxiv.org/pdf/2211.09110v2#page=81",
      "labels": [
        "原文 §11，PDF 第81页"
      ],
      "role": "primary",
      "sourceVersion": "v2"
    }
  ],
  "related": [],
  "assets": [],
  "coverage": {
    "scope": "mainline",
    "basis": "sections",
    "sections": [
      "§1–4",
      "§7–8",
      "§11"
    ],
    "figuresViewed": [
      "Figure 5",
      "Figure 6",
      "Figure 7",
      "Figure 24"
    ],
    "limitations": [
      "Evaluation-mainline guide; not every scenario or appendix is explained.",
      "Historical model results are not current rankings.",
      "No experiments were reproduced."
    ],
    "reviewBasis": "Inherited content/source review; no new source or figure audit during packaging."
  }
}
